<?xml version="1.0" encoding="ISO-8859-1" ?>
<!DOCTYPE giant_class_set_file 
  SYSTEM "giant_class_set_file.dtd">

<giant_class_set_file>

  <!-- All node classes being a member of the class set -->
  <associated_node_classes>
  
    <super_node_class     super_node_class_name = "T_Node"/>                      
    <super_node_class     super_node_class_name = "Prog_Unit"/>  

  </associated_node_classes>
  
  <!-- All edge classes being a member of the class set -->
  <associated_edge_classes>
 
    <super_edge_class
      super_start_node_class = "Prog_Unit"
      attribute_name         = "Subunits" />        
    <super_edge_class
      super_start_node_class = "Op"
      attribute_name         = "*" /> 	      
    <super_edge_class
      super_start_node_class = "Return_Statement"
      attribute_name         = "*" /> 	

  </associated_edge_classes>
 

</giant_class_set_file>

